{
  "schema_version": "v0.2",
  "record_type": "campaign_plan",
  "id": "plan-demo",
  "created_at": "2026-09-10T00:00:00Z",
  "client_id": "client-demo",
  "account_id": "acct-demo",
  "campaign_id": "campaign-demo",
  "objective": "Test a bounded creative with a known daily cap.",
  "budget": {"currency": "USD", "daily_budget_micros": 25000000, "maximum_effect": {"kind": "maximum_total_spend_micros", "amount_micros": 250000000}},
  "expected_ui_revision": "ui-7",
  "evidence_reference": "local-example-no-external-claim"
}
